{
  "id": "dragonite-evolved",
  "displayName": "망나뇽 (Dragonite)",
  "description": "Custom connor-pet build (evolved form): 망나뇽 (Dragonite) reacts to live Orca/Claude Code agent status, skinned as Pokémon status conditions — blocked/waiting=Freeze, done=Infatuation, nothing=Sleep, working=running. Built from PokeAPI gen5 battle sprites.",
  "spritesheetPath": "spritesheet.png",
  "frame": {
    "width": 320,
    "height": 320
  },
  "fps": 6,
  "defaultAnimation": "idle",
  "animations": {
    "idle": {
      "row": 0,
      "frames": 12,
      "frameDurationsMs": [
        400,
        400,
        400,
        400,
        400,
        400,
        400,
        400,
        400,
        400,
        400,
        400
      ]
    },
    "running-right": {
      "row": 1,
      "frames": 12,
      "frameDurationsMs": [
        120,
        120,
        120,
        120,
        120,
        120,
        120,
        120,
        120,
        120,
        120,
        120
      ]
    },
    "running-left": {
      "row": 2,
      "frames": 12,
      "frameDurationsMs": [
        120,
        120,
        120,
        120,
        120,
        120,
        120,
        120,
        120,
        120,
        120,
        120
      ]
    },
    "waving": {
      "row": 3,
      "frames": 10,
      "frameDurationsMs": [
        160,
        160,
        160,
        160,
        160,
        160,
        160,
        160,
        160,
        160
      ]
    },
    "jumping": {
      "row": 4,
      "frames": 10,
      "frameDurationsMs": [
        90,
        90,
        90,
        90,
        90,
        90,
        90,
        90,
        90,
        90
      ]
    },
    "failed": {
      "row": 5,
      "frames": 10,
      "frameDurationsMs": [
        130,
        130,
        130,
        130,
        130,
        130,
        130,
        130,
        130,
        130
      ]
    },
    "waiting": {
      "row": 6,
      "frames": 8,
      "frameDurationsMs": [
        300,
        300,
        300,
        300,
        300,
        300,
        300,
        300
      ]
    },
    "running": {
      "row": 7,
      "frames": 12,
      "frameDurationsMs": [
        180,
        180,
        180,
        180,
        180,
        180,
        180,
        180,
        180,
        180,
        180,
        180
      ]
    },
    "review": {
      "row": 8,
      "frames": 12,
      "frameDurationsMs": [
        220,
        220,
        220,
        220,
        220,
        220,
        220,
        220,
        220,
        220,
        220,
        220
      ]
    },
    "hyper-beam": {
      "row": 9,
      "frames": 10,
      "frameDurationsMs": [
        110,
        110,
        110,
        110,
        110,
        110,
        110,
        110,
        110,
        110
      ]
    }
  },
  "skill": {
    "row": "hyper-beam",
    "effect": "hyper_beam.png",
    "mouthByFrame": [
      {
        "x": 83,
        "y": 107,
        "grow": 0.0
      },
      {
        "x": 89,
        "y": 107,
        "grow": 0.0
      },
      {
        "x": 95,
        "y": 107,
        "grow": 0.0
      },
      {
        "x": 103,
        "y": 107,
        "grow": 0.45
      },
      {
        "x": 107,
        "y": 107,
        "grow": 0.588
      },
      {
        "x": 111,
        "y": 107,
        "grow": 0.725
      },
      {
        "x": 115,
        "y": 107,
        "grow": 0.863
      },
      {
        "x": 119,
        "y": 107,
        "grow": 1.0
      },
      {
        "x": 94,
        "y": 107,
        "grow": 0.0
      },
      {
        "x": 83,
        "y": 107,
        "grow": 0.0
      }
    ]
  }
}