{
  "id": "squirtle-kkobugi",
  "displayName": "꼬부기 (Squirtle)",
  "description": "Custom connor-pet build: Squirtle / 꼬부기 reacts to live Orca agent/project status, skinned as Pokémon status conditions — blocked/waiting=Freeze, done=Infatuation, nothing=Sleep, working=running (unchanged). Built from PokeAPI gen5 battle sprites.",
  "spritesheetPath": "spritesheet.png",
  "frame": {
    "width": 200,
    "height": 200
  },
  "fps": 6,
  "defaultAnimation": "idle",
  "animations": {
    "idle": {
      "row": 0,
      "frames": 12,
      "frameDurationsMs": [
        400,
        400,
        400,
        400,
        400,
        400,
        400,
        400,
        400,
        400,
        400,
        400
      ]
    },
    "running-right": {
      "row": 1,
      "frames": 12,
      "frameDurationsMs": [
        120,
        120,
        120,
        120,
        120,
        120,
        120,
        120,
        120,
        120,
        120,
        120
      ]
    },
    "running-left": {
      "row": 2,
      "frames": 12,
      "frameDurationsMs": [
        120,
        120,
        120,
        120,
        120,
        120,
        120,
        120,
        120,
        120,
        120,
        120
      ]
    },
    "waving": {
      "row": 3,
      "frames": 10,
      "frameDurationsMs": [
        160,
        160,
        160,
        160,
        160,
        160,
        160,
        160,
        160,
        160
      ]
    },
    "jumping": {
      "row": 4,
      "frames": 10,
      "frameDurationsMs": [
        90,
        90,
        90,
        90,
        90,
        90,
        90,
        90,
        90,
        90
      ]
    },
    "failed": {
      "row": 5,
      "frames": 10,
      "frameDurationsMs": [
        130,
        130,
        130,
        130,
        130,
        130,
        130,
        130,
        130,
        130
      ]
    },
    "waiting": {
      "row": 6,
      "frames": 8,
      "frameDurationsMs": [
        300,
        300,
        300,
        300,
        300,
        300,
        300,
        300
      ]
    },
    "running": {
      "row": 7,
      "frames": 12,
      "frameDurationsMs": [
        180,
        180,
        180,
        180,
        180,
        180,
        180,
        180,
        180,
        180,
        180,
        180
      ]
    },
    "review": {
      "row": 8,
      "frames": 12,
      "frameDurationsMs": [
        220,
        220,
        220,
        220,
        220,
        220,
        220,
        220,
        220,
        220,
        220,
        220
      ]
    },
    "water-gun": {
      "row": 9,
      "frames": 10,
      "frameDurationsMs": [
        110,
        110,
        110,
        110,
        110,
        110,
        110,
        110,
        110,
        110
      ]
    }
  },
  "skill": {
    "row": "water-gun",
    "effect": "water_jet.png",
    "mouthByFrame": [
      {
        "x": 62,
        "y": 79,
        "grow": 0.0
      },
      {
        "x": 68,
        "y": 79,
        "grow": 0.0
      },
      {
        "x": 74,
        "y": 79,
        "grow": 0.0
      },
      {
        "x": 82,
        "y": 79,
        "grow": 0.45
      },
      {
        "x": 87,
        "y": 79,
        "grow": 0.588
      },
      {
        "x": 91,
        "y": 79,
        "grow": 0.725
      },
      {
        "x": 95,
        "y": 79,
        "grow": 0.863
      },
      {
        "x": 99,
        "y": 79,
        "grow": 1.0
      },
      {
        "x": 73,
        "y": 79,
        "grow": 0.0
      },
      {
        "x": 62,
        "y": 79,
        "grow": 0.0
      }
    ]
  }
}