{
  "id": "bichon-bichon",
  "displayName": "비숑 (Bichon)",
  "description": "Custom connor-pet build: a white Bichon Frise reacts to live Orca/Claude Code agent status, skinned as Pokémon status conditions — blocked/waiting=Freeze, done=Infatuation, nothing=Sleep, working=running. Hand-drawn pixel art (not from PokeAPI). Does not battle, for animal-welfare reasons.",
  "spritesheetPath": "spritesheet.png",
  "frame": {
    "width": 200,
    "height": 200
  },
  "fps": 6,
  "defaultAnimation": "idle",
  "animations": {
    "idle": {
      "row": 0,
      "frames": 12,
      "frameDurationsMs": [
        400,
        400,
        400,
        400,
        400,
        400,
        400,
        400,
        400,
        400,
        400,
        400
      ]
    },
    "running-right": {
      "row": 1,
      "frames": 12,
      "frameDurationsMs": [
        120,
        120,
        120,
        120,
        120,
        120,
        120,
        120,
        120,
        120,
        120,
        120
      ]
    },
    "running-left": {
      "row": 2,
      "frames": 12,
      "frameDurationsMs": [
        120,
        120,
        120,
        120,
        120,
        120,
        120,
        120,
        120,
        120,
        120,
        120
      ]
    },
    "waving": {
      "row": 3,
      "frames": 10,
      "frameDurationsMs": [
        160,
        160,
        160,
        160,
        160,
        160,
        160,
        160,
        160,
        160
      ]
    },
    "jumping": {
      "row": 4,
      "frames": 10,
      "frameDurationsMs": [
        90,
        90,
        90,
        90,
        90,
        90,
        90,
        90,
        90,
        90
      ]
    },
    "failed": {
      "row": 5,
      "frames": 10,
      "frameDurationsMs": [
        130,
        130,
        130,
        130,
        130,
        130,
        130,
        130,
        130,
        130
      ]
    },
    "waiting": {
      "row": 6,
      "frames": 8,
      "frameDurationsMs": [
        300,
        300,
        300,
        300,
        300,
        300,
        300,
        300
      ]
    },
    "running": {
      "row": 7,
      "frames": 12,
      "frameDurationsMs": [
        180,
        180,
        180,
        180,
        180,
        180,
        180,
        180,
        180,
        180,
        180,
        180
      ]
    },
    "review": {
      "row": 8,
      "frames": 12,
      "frameDurationsMs": [
        220,
        220,
        220,
        220,
        220,
        220,
        220,
        220,
        220,
        220,
        220,
        220
      ]
    }
  }
}